{
  "schemaVersion": "2.0",
  "meta": {
    "id": "deck-ai-coding-agent",
    "slug": "ai-coding-agent",
    "title": "AI Coding Agent trong phát triển phần mềm",
    "description": "5 phút về cách đội kỹ thuật và quản lý áp dụng AI Coding Agent một cách có kiểm soát.",
    "language": "vi",
    "audience": "Đội ngũ kỹ thuật và quản lý",
    "objective": "Thống nhất lý do và cách bắt đầu một pilot AI Coding Agent có kiểm soát trong vòng 90 ngày.",
    "templateId": "transformation-roadmap",
    "tags": ["ai", "coding-agent", "phat-trien-phan-mem", "tech"],
    "createdAt": "2026-08-02T00:00:00Z",
    "updatedAt": "2026-08-02T00:00:00Z"
  },
  "canvas": {
    "aspectRatio": "16:9",
    "width": 1600,
    "height": 900,
    "safeMargin": 64,
    "grid": 8,
    "responsiveMode": "hybrid"
  },
  "theme": {
    "id": "oceanic-blueprint",
    "mode": "light",
    "overrides": {
      "accent": "#0891B2",
      "accentSoft": "#E0F4F8",
      "benefit": "#047857",
      "benefitSoft": "#E7F6EF",
      "risk": "#B42318",
      "riskSoft": "#FDEBE9",
      "warn": "#B45309",
      "warnSoft": "#FDF0E3",
      "headingFont": "Manrope",
      "bodyFont": "Inter",
      "codeFont": "JetBrains Mono"
    }
  },
  "presentation": {
    "mode": "horizontal",
    "transition": "crossfade",
    "keyboard": true,
    "touch": true,
    "deepLinks": true,
    "overview": true,
    "speakerView": true,
    "progress": true,
    "controls": true,
    "reducedMotion": "respect-system",
    "autoplay": {
      "enabled": false,
      "intervalMs": 15000,
      "loop": false,
      "pauseOnInteraction": true
    }
  },
  "editor": {
    "enabled": true,
    "toolbar": true,
    "history": true,
    "snapToGrid": true,
    "guides": true,
    "notes": true,
    "autosave": true,
    "allowedBlockTypes": [
      "heading",
      "text",
      "bullets",
      "callout",
      "caption",
      "metric",
      "table",
      "process",
      "diagram",
      "citation"
    ]
  },
  "assets": [],
  "slides": [
    {
      "id": "s1-mo-dau",
      "title": "AI Coding Agent: làm phần mềm nhanh hơn, không phải thay kỹ sư",
      "layout": "title-hero",
      "transition": "crossfade",
      "speakerNotes": "Mở đầu bằng luận điểm, không phải công nghệ. Mục tiêu 5 phút: 1) AI coding agent không thay kỹ sư mà lo bỏ các việc lặp lại; 2) giá trị đến từ quy trình có kiểm soát; 3) bắt đầu một pilot nhỏ, đo lường trong 90 ngày. Giới thiệu bản thân và đội trước khi trình chiếu slide 2.",
      "blocks": [
        {
          "id": "b1-kicker",
          "type": "text",
          "content": "AI CODING AGENT · TRONG PHÁT TRIỂN PHẦN MỀM",
          "frame": { "x": 120, "y": 150, "w": 980, "h": 44 },
          "style": { "variant": "kicker" },
          "animation": {
            "id": "fade-in",
            "trigger": "on-enter",
            "order": 0,
            "durationMs": 400,
            "easing": "ease-out",
            "reducedMotionFallback": "appear"
          }
        },
        {
          "id": "b1-title",
          "type": "heading",
          "content": "AI Coding Agent: làm phần mềm nhanh hơn, không phải thay kỹ sư",
          "frame": { "x": 118, "y": 216, "w": 1300, "h": 250 },
          "style": { "level": 1 },
          "animation": {
            "id": "fade-in",
            "trigger": "on-enter",
            "order": 1,
            "durationMs": 500,
            "easing": "ease-out",
            "reducedMotionFallback": "appear"
          }
        },
        {
          "id": "b1-subtitle",
          "type": "text",
          "content": "Bức tranh thực tế về trợ lý lập trình AI: nó giúp ích ở đâu, cần giám sát thế nào, và cách bắt đầu có kiểm soát trong 90 ngày.",
          "frame": { "x": 122, "y": 470, "w": 1000, "h": 120 },
          "style": { "variant": "subtitle" },
          "animation": {
            "id": "fade-in",
            "trigger": "after-previous",
            "order": 2,
            "durationMs": 500,
            "easing": "ease-out",
            "reducedMotionFallback": "appear"
          }
        },
        {
          "id": "b1-meta",
          "type": "text",
          "content": "5 phút · Đội Kỹ thuật & Quản lý · [Tên người trình bày] · [Ngày]",
          "frame": { "x": 122, "y": 640, "w": 760, "h": 48 },
          "style": { "variant": "meta" },
          "animation": {
            "id": "fade-in",
            "trigger": "after-previous",
            "order": 3,
            "durationMs": 400,
            "easing": "ease-out",
            "reducedMotionFallback": "appear"
          }
        },
        {
          "id": "b1-loop",
          "type": "diagram",
          "content": {
            "width": 460,
            "height": 460,
            "kind": "flow",
            "nodes": [
              { "id": "n1", "label": "Kỹ sư nêu ý định", "kind": "actor", "x": 150, "y": 30, "w": 160, "h": 92 },
              { "id": "n2", "label": "Agent đề xuất", "kind": "agent", "x": 270, "y": 190, "w": 160, "h": 92 },
              { "id": "n3", "label": "Diff · code · test", "kind": "data", "x": 150, "y": 340, "w": 160, "h": 92 },
              { "id": "n4", "label": "Kỹ sư review", "kind": "actor", "x": 30, "y": 190, "w": 160, "h": 92 }
            ],
            "edges": [
              { "from": "n1", "to": "n2", "label": "task" },
              { "from": "n2", "to": "n3", "label": "đề xuất" },
              { "from": "n3", "to": "n4", "label": "review" },
              { "from": "n4", "to": "n1", "label": "merge" }
            ],
            "notes": []
          },
          "frame": { "x": 1030, "y": 180, "w": 460, "h": 460 },
          "alt": "Vòng lặp cộng tác: kỹ sư nêu ý định, agent đề xuất code, kỹ sư review và merge.",
          "ariaLabel": "Vòng lặp cộng tác giữa kỹ sư và coding agent.",
          "animation": {
            "id": "fade-in",
            "trigger": "with-previous",
            "order": 0,
            "durationMs": 500,
            "easing": "ease-out",
            "reducedMotionFallback": "appear"
          }
        }
      ],
      "sources": [],
      "interactions": []
    },
    {
      "id": "s2-van-de",
      "title": "Thời gian của kỹ sư bị đốt vào việc lặp lại, không phải thiết kế",
      "layout": "two-column",
      "transition": "crossfade",
      "speakerNotes": "Dẫn dắt: đội không thiếu năng lực, mà cấu trúc công việc khiến kỹ sư lặp lại. Đọc 4 điểm nghẽn bên trái; bên phải là vòng lặp phát triển điển hình với điểm nghẽn ở review và hiểu code cũ. Không cần số liệu cứng ở slide này — nhấn mạnh cảm giác thực tế của đội.",
      "blocks": [
        {
          "id": "b2-kicker",
          "type": "text",
          "content": "02 · VẤN ĐỀ HIỆN TẠI",
          "frame": { "x": 64, "y": 84, "w": 800, "h": 40 },
          "style": { "variant": "kicker" }
        },
        {
          "id": "b2-title",
          "type": "heading",
          "content": "Thời gian của kỹ sư bị đốt vào việc lặp lại, không phải thiết kế",
          "frame": { "x": 62, "y": 130, "w": 1440, "h": 120 },
          "style": { "level": 2 }
        },
        {
          "id": "b2-lead",
          "type": "text",
          "content": "Không phải thiếu năng lực — mà là cấu trúc công việc khiến kỹ sư lặp đi lặp lại các thao tác.",
          "frame": { "x": 64, "y": 296, "w": 800, "h": 84 },
          "style": { "variant": "lead" }
        },
        {
          "id": "b2-bullets",
          "type": "bullets",
          "content": {
            "items": [
              "Viết boilerplate, code mẫu và “dán – sửa” lặp đi lặp lại",
              "Code review, kiểm thử và sửa lỗi vận hành chiếm phần lớn vòng lặp",
              "Chuyển ngữ cảnh liên tục giữa nhiều task, nhiều repo",
              "Kiến thức ẩn trong code cũ — khó hiểu, khó bảo trì, khó onboard"
            ]
          },
          "frame": { "x": 64, "y": 400, "w": 800, "h": 360 },
          "style": { "marker": "accent" },
          "animation": {
            "id": "stagger",
            "trigger": "on-click",
            "order": 0,
            "durationMs": 350,
            "easing": "ease-out",
            "reducedMotionFallback": "appear"
          }
        },
        {
          "id": "b2-diagram",
          "type": "diagram",
          "content": {
            "width": 606,
            "height": 470,
            "kind": "flow",
            "nodes": [
              { "id": "n1", "label": "Viết code", "kind": "data", "x": 40, "y": 140, "w": 160, "h": 100 },
              { "id": "n2", "label": "Review", "kind": "data", "x": 240, "y": 140, "w": 160, "h": 100 },
              { "id": "n3", "label": "Test & fix", "kind": "data", "x": 440, "y": 140, "w": 160, "h": 100 }
            ],
            "edges": [
              { "from": "n1", "to": "n2", "label": "chờ review" },
              { "from": "n2", "to": "n3", "label": "bug lặp" },
              { "from": "n3", "to": "n1", "label": "quay vòng", "bend": "down" }
            ],
            "notes": [
              { "x": 40, "y": 330, "w": 560, "h": 90, "text": "Điểm nghẽn điển hình: review chậm và phải hiểu lại code cũ mỗi lần sửa.", "tone": "warn" }
            ]
          },
          "frame": { "x": 930, "y": 296, "w": 606, "h": 470 },
          "alt": "Vòng lặp phát triển: viết code, review, test và fix, quay vòng — điểm nghẽn ở review và hiểu code cũ.",
          "ariaLabel": "Sơ đồ vòng lặp phát triển phần mềm với điểm nghẽn ở review.",
          "animation": {
            "id": "fade-in",
            "trigger": "after-previous",
            "order": 1,
            "durationMs": 500,
            "easing": "ease-out",
            "reducedMotionFallback": "appear"
          }
        },
        {
          "id": "b2-caption",
          "type": "caption",
          "content": "Vòng lặp phát triển điển hình: nhiều vòng quay chậm, giá trị rò rỉ ở các bước chờ đợi.",
          "frame": { "x": 930, "y": 788, "w": 606, "h": 64 },
          "style": {}
        }
      ],
      "sources": [],